{
 "format_version": "0.1",
 "geohash": "c22yj",
 "generated": "2026-06-10T19:30:54+00:00",
 "wants": [
  {
   "id": "wd-p18/Q49895117",
   "publisher": "wikimedia/wikidata-p18-missing",
   "type": "photo",
   "subject": {
    "wikidata_qid": "Q49895117",
    "label": "Dolphin Point",
    "classes": [
     "Q185113"
    ],
    "classifier_labels": [
     "coastline",
     "landscape"
    ]
   },
   "geo": {
    "lat": 47.502777777,
    "lon": -122.451388888,
    "radius_m": 600
   },
   "priority": {
    "sitelinks": 1
   },
   "constraints": {
    "license_required": "CC-BY-SA-4.0",
    "sensitivity": [
     "strip_gps_homes",
     "flag_faces"
    ]
   },
   "fulfillment": {
    "endpoint": "commons_upload",
    "structured_data": {
     "depicts": "Q49895117"
    }
   },
   "status_check": {
    "sparql_ask": "ASK { wd:Q49895117 wdt:P18 [] }"
   }
  }
 ]
}
