{
 "format_version": "0.1",
 "geohash": "c23n0",
 "generated": "2026-06-10T18:45:23+00:00",
 "wants": [
  {
   "id": "wd-p18/Q48999785",
   "publisher": "wikimedia/wikidata-p18-missing",
   "type": "photo",
   "subject": {
    "wikidata_qid": "Q48999785",
    "label": "South 120th Street Reservoir Dam",
    "classes": [
     "Q12323"
    ],
    "classifier_labels": [
     "dam"
    ]
   },
   "geo": {
    "lat": 47.496388888,
    "lon": -122.314444444,
    "radius_m": 400
   },
   "priority": {
    "sitelinks": 1
   },
   "constraints": {
    "license_required": "CC-BY-SA-4.0",
    "sensitivity": [
     "strip_gps_homes",
     "flag_faces"
    ]
   },
   "fulfillment": {
    "endpoint": "commons_upload",
    "structured_data": {
     "depicts": "Q48999785"
    }
   },
   "status_check": {
    "sparql_ask": "ASK { wd:Q48999785 wdt:P18 [] }"
   }
  },
  {
   "id": "wd-p18/Q49501760",
   "publisher": "wikimedia/wikidata-p18-missing",
   "type": "photo",
   "subject": {
    "wikidata_qid": "Q49501760",
    "label": "Hilltop Park",
    "classes": [
     "Q22698"
    ],
    "classifier_labels": [
     "park",
     "green space"
    ]
   },
   "geo": {
    "lat": 47.49,
    "lon": -122.3,
    "radius_m": 400
   },
   "priority": {
    "sitelinks": 1
   },
   "constraints": {
    "license_required": "CC-BY-SA-4.0",
    "sensitivity": [
     "strip_gps_homes",
     "flag_faces"
    ]
   },
   "fulfillment": {
    "endpoint": "commons_upload",
    "structured_data": {
     "depicts": "Q49501760"
    }
   },
   "status_check": {
    "sparql_ask": "ASK { wd:Q49501760 wdt:P18 [] }"
   }
  }
 ]
}
