{
 "format_version": "0.1",
 "geohash": "c23n8",
 "generated": "2026-06-10T19:30:54+00:00",
 "wants": [
  {
   "id": "wd-p18/Q4875926",
   "publisher": "wikimedia/wikidata-p18-missing",
   "type": "photo",
   "subject": {
    "wikidata_qid": "Q4875926",
    "label": "Beacon Food Forest",
    "classes": [
     "Q22698"
    ],
    "classifier_labels": [
     "park",
     "green space"
    ]
   },
   "geo": {
    "lat": 47.5692,
    "lon": -122.313,
    "radius_m": 400
   },
   "priority": {
    "sitelinks": 2
   },
   "constraints": {
    "license_required": "CC-BY-SA-4.0",
    "sensitivity": [
     "strip_gps_homes",
     "flag_faces"
    ]
   },
   "fulfillment": {
    "endpoint": "commons_upload",
    "structured_data": {
     "depicts": "Q4875926"
    }
   },
   "status_check": {
    "sparql_ask": "ASK { wd:Q4875926 wdt:P18 [] }"
   }
  },
  {
   "id": "wd-p18/Q115802015",
   "publisher": "wikimedia/wikidata-p18-missing",
   "type": "photo",
   "subject": {
    "wikidata_qid": "Q115802015",
    "label": "Supernova",
    "classes": [
     "Q622425"
    ],
    "classifier_labels": [
     "bar",
     "storefront"
    ]
   },
   "geo": {
    "lat": 47.574444444,
    "lon": -122.333611111,
    "radius_m": 150
   },
   "priority": {
    "sitelinks": 1
   },
   "constraints": {
    "license_required": "CC-BY-SA-4.0",
    "sensitivity": [
     "strip_gps_homes",
     "flag_faces"
    ]
   },
   "fulfillment": {
    "endpoint": "commons_upload",
    "structured_data": {
     "depicts": "Q115802015"
    }
   },
   "status_check": {
    "sparql_ask": "ASK { wd:Q115802015 wdt:P18 [] }"
   }
  },
  {
   "id": "wd-p18/Q115804438",
   "publisher": "wikimedia/wikidata-p18-missing",
   "type": "photo",
   "subject": {
    "wikidata_qid": "Q115804438",
    "label": "Musang",
    "classes": [
     "Q11707"
    ],
    "classifier_labels": [
     "restaurant",
     "storefront"
    ]
   },
   "geo": {
    "lat": 47.580333333,
    "lon": -122.312861111,
    "radius_m": 150
   },
   "priority": {
    "sitelinks": 1
   },
   "constraints": {
    "license_required": "CC-BY-SA-4.0",
    "sensitivity": [
     "strip_gps_homes",
     "flag_faces"
    ]
   },
   "fulfillment": {
    "endpoint": "commons_upload",
    "structured_data": {
     "depicts": "Q115804438"
    }
   },
   "status_check": {
    "sparql_ask": "ASK { wd:Q115804438 wdt:P18 [] }"
   }
  },
  {
   "id": "wd-p18/Q115805058",
   "publisher": "wikimedia/wikidata-p18-missing",
   "type": "photo",
   "subject": {
    "wikidata_qid": "Q115805058",
    "label": "Bar del Corso",
    "classes": [
     "Q11707"
    ],
    "classifier_labels": [
     "restaurant",
     "storefront"
    ]
   },
   "geo": {
    "lat": 47.575416666,
    "lon": -122.309583333,
    "radius_m": 150
   },
   "priority": {
    "sitelinks": 1
   },
   "constraints": {
    "license_required": "CC-BY-SA-4.0",
    "sensitivity": [
     "strip_gps_homes",
     "flag_faces"
    ]
   },
   "fulfillment": {
    "endpoint": "commons_upload",
    "structured_data": {
     "depicts": "Q115805058"
    }
   },
   "status_check": {
    "sparql_ask": "ASK { wd:Q115805058 wdt:P18 [] }"
   }
  },
  {
   "id": "wd-p18/Q118948248",
   "publisher": "wikimedia/wikidata-p18-missing",
   "type": "photo",
   "subject": {
    "wikidata_qid": "Q118948248",
    "label": "The Mitt",
    "classes": [
     "Q860861"
    ],
    "classifier_labels": [
     "sculpture",
     "statue"
    ]
   },
   "geo": {
    "lat": 47.592222222,
    "lon": -122.333833333,
    "radius_m": 100
   },
   "priority": {
    "sitelinks": 1
   },
   "constraints": {
    "license_required": "CC-BY-SA-4.0",
    "sensitivity": [
     "strip_gps_homes",
     "flag_faces"
    ]
   },
   "fulfillment": {
    "endpoint": "commons_upload",
    "structured_data": {
     "depicts": "Q118948248"
    }
   },
   "status_check": {
    "sparql_ask": "ASK { wd:Q118948248 wdt:P18 [] }"
   }
  },
  {
   "id": "wd-p18/Q48979682",
   "publisher": "wikimedia/wikidata-p18-missing",
   "type": "photo",
   "subject": {
    "wikidata_qid": "Q48979682",
    "label": "Beacon Hill North Reservoir Dam",
    "classes": [
     "Q12323"
    ],
    "classifier_labels": [
     "dam"
    ]
   },
   "geo": {
    "lat": 47.571388888,
    "lon": -122.311111111,
    "radius_m": 400
   },
   "priority": {
    "sitelinks": 1
   },
   "constraints": {
    "license_required": "CC-BY-SA-4.0",
    "sensitivity": [
     "strip_gps_homes",
     "flag_faces"
    ]
   },
   "fulfillment": {
    "endpoint": "commons_upload",
    "structured_data": {
     "depicts": "Q48979682"
    }
   },
   "status_check": {
    "sparql_ask": "ASK { wd:Q48979682 wdt:P18 [] }"
   }
  },
  {
   "id": "wd-p18/Q48979683",
   "publisher": "wikimedia/wikidata-p18-missing",
   "type": "photo",
   "subject": {
    "wikidata_qid": "Q48979683",
    "label": "Beacon Hill South Reservoir Dam",
    "classes": [
     "Q12323"
    ],
    "classifier_labels": [
     "dam"
    ]
   },
   "geo": {
    "lat": 47.569722222,
    "lon": -122.311111111,
    "radius_m": 400
   },
   "priority": {
    "sitelinks": 1
   },
   "constraints": {
    "license_required": "CC-BY-SA-4.0",
    "sensitivity": [
     "strip_gps_homes",
     "flag_faces"
    ]
   },
   "fulfillment": {
    "endpoint": "commons_upload",
    "structured_data": {
     "depicts": "Q48979683"
    }
   },
   "status_check": {
    "sparql_ask": "ASK { wd:Q48979683 wdt:P18 [] }"
   }
  },
  {
   "id": "wd-p18/Q49111363",
   "publisher": "wikimedia/wikidata-p18-missing",
   "type": "photo",
   "subject": {
    "wikidata_qid": "Q49111363",
    "label": "Georgetown Reach",
    "classes": [
     "Q1210950"
    ],
    "classifier_labels": [
     "water"
    ]
   },
   "geo": {
    "lat": 47.556666666,
    "lon": -122.343055555,
    "radius_m": 800
   },
   "priority": {
    "sitelinks": 1
   },
   "constraints": {
    "license_required": "CC-BY-SA-4.0",
    "sensitivity": [
     "strip_gps_homes",
     "flag_faces"
    ]
   },
   "fulfillment": {
    "endpoint": "commons_upload",
    "structured_data": {
     "depicts": "Q49111363"
    }
   },
   "status_check": {
    "sparql_ask": "ASK { wd:Q49111363 wdt:P18 [] }"
   }
  },
  {
   "id": "wd-p18/Q111393655",
   "publisher": "wikimedia/wikidata-p18-missing",
   "type": "photo",
   "subject": {
    "wikidata_qid": "Q111393655",
    "label": "Silver Cloud Hotel - Seattle Stadium",
    "classes": [
     "Q27686"
    ],
    "classifier_labels": [
     "hotel",
     "building"
    ]
   },
   "geo": {
    "lat": 47.5927,
    "lon": -122.33368,
    "radius_m": 250
   },
   "priority": {
    "sitelinks": 0
   },
   "constraints": {
    "license_required": "CC-BY-SA-4.0",
    "sensitivity": [
     "strip_gps_homes",
     "flag_faces"
    ]
   },
   "fulfillment": {
    "endpoint": "commons_upload",
    "structured_data": {
     "depicts": "Q111393655"
    }
   },
   "status_check": {
    "sparql_ask": "ASK { wd:Q111393655 wdt:P18 [] }"
   }
  },
  {
   "id": "wd-p18/Q43306522",
   "publisher": "wikimedia/wikidata-p18-missing",
   "type": "photo",
   "subject": {
    "wikidata_qid": "Q43306522",
    "label": "Beacon Theatre",
    "classes": [
     "Q19860854",
     "Q41253"
    ],
    "classifier_labels": [
     "movie theater",
     "storefront",
     "building"
    ]
   },
   "geo": {
    "lat": 47.5819313,
    "lon": -122.3156289,
    "radius_m": 150
   },
   "priority": {
    "sitelinks": 0
   },
   "constraints": {
    "license_required": "CC-BY-SA-4.0",
    "sensitivity": [
     "strip_gps_homes",
     "flag_faces"
    ]
   },
   "fulfillment": {
    "endpoint": "commons_upload",
    "structured_data": {
     "depicts": "Q43306522"
    }
   },
   "status_check": {
    "sparql_ask": "ASK { wd:Q43306522 wdt:P18 [] }"
   },
   "time_window": {
    "historical": true
   }
  },
  {
   "id": "wd-p18/Q43306668",
   "publisher": "wikimedia/wikidata-p18-missing",
   "type": "photo",
   "subject": {
    "wikidata_qid": "Q43306668",
    "label": "Mission Theatre, Georgetown",
    "classes": [
     "Q41253"
    ],
    "classifier_labels": [
     "movie theater",
     "storefront"
    ]
   },
   "geo": {
    "lat": 47.551403,
    "lon": -122.319109,
    "radius_m": 150
   },
   "priority": {
    "sitelinks": 0
   },
   "constraints": {
    "license_required": "CC-BY-SA-4.0",
    "sensitivity": [
     "strip_gps_homes",
     "flag_faces"
    ]
   },
   "fulfillment": {
    "endpoint": "commons_upload",
    "structured_data": {
     "depicts": "Q43306668"
    }
   },
   "status_check": {
    "sparql_ask": "ASK { wd:Q43306668 wdt:P18 [] }"
   }
  },
  {
   "id": "wd-p18/Q43306790",
   "publisher": "wikimedia/wikidata-p18-missing",
   "type": "photo",
   "subject": {
    "wikidata_qid": "Q43306790",
    "label": "Victory Theater",
    "classes": [
     "Q19860854",
     "Q41253"
    ],
    "classifier_labels": [
     "movie theater",
     "storefront",
     "building"
    ]
   },
   "geo": {
    "lat": 47.5908846,
    "lon": -122.3077916,
    "radius_m": 150
   },
   "priority": {
    "sitelinks": 0
   },
   "constraints": {
    "license_required": "CC-BY-SA-4.0",
    "sensitivity": [
     "strip_gps_homes",
     "flag_faces"
    ]
   },
   "fulfillment": {
    "endpoint": "commons_upload",
    "structured_data": {
     "depicts": "Q43306790"
    }
   },
   "status_check": {
    "sparql_ask": "ASK { wd:Q43306790 wdt:P18 [] }"
   },
   "time_window": {
    "historical": true
   }
  }
 ]
}
