{
 "format_version": "0.1",
 "geohash": "c23n1",
 "generated": "2026-06-10T19:30:54+00:00",
 "wants": [
  {
   "id": "wd-p18/Q43305522",
   "publisher": "wikimedia/wikidata-p18-missing",
   "type": "photo",
   "subject": {
    "wikidata_qid": "Q43305522",
    "label": "Duwamish Drive-In",
    "classes": [
     "Q19860854",
     "Q41253",
     "Q786922"
    ],
    "classifier_labels": [
     "movie theater",
     "storefront",
     "drive-in theater",
     "building"
    ]
   },
   "geo": {
    "lat": 47.5029404,
    "lon": -122.293131,
    "radius_m": 300
   },
   "priority": {
    "sitelinks": 0
   },
   "constraints": {
    "license_required": "CC-BY-SA-4.0",
    "sensitivity": [
     "strip_gps_homes",
     "flag_faces"
    ]
   },
   "fulfillment": {
    "endpoint": "commons_upload",
    "structured_data": {
     "depicts": "Q43305522"
    }
   },
   "status_check": {
    "sparql_ask": "ASK { wd:Q43305522 wdt:P18 [] }"
   },
   "time_window": {
    "historical": true
   }
  }
 ]
}
