{
 "format_version": "0.1",
 "geohash": "c23p3",
 "generated": "2026-06-10T19:30:54+00:00",
 "wants": [
  {
   "id": "wd-p18/Q49388320",
   "publisher": "wikimedia/wikidata-p18-missing",
   "type": "photo",
   "subject": {
    "wikidata_qid": "Q49388320",
    "label": "Pontiac Bay",
    "classes": [
     "Q39594"
    ],
    "classifier_labels": [
     "water",
     "landscape"
    ]
   },
   "geo": {
    "lat": 47.688333333,
    "lon": -122.261944444,
    "radius_m": 800
   },
   "priority": {
    "sitelinks": 1
   },
   "constraints": {
    "license_required": "CC-BY-SA-4.0",
    "sensitivity": [
     "strip_gps_homes",
     "flag_faces"
    ]
   },
   "fulfillment": {
    "endpoint": "commons_upload",
    "structured_data": {
     "depicts": "Q49388320"
    }
   },
   "status_check": {
    "sparql_ask": "ASK { wd:Q49388320 wdt:P18 [] }"
   }
  }
 ]
}
