{
 "format_version": "0.1",
 "geohash": "c23n3",
 "generated": "2026-06-10T18:45:23+00:00",
 "wants": [
  {
   "id": "wd-p18/Q4700847",
   "publisher": "wikimedia/wikidata-p18-missing",
   "type": "photo",
   "subject": {
    "wikidata_qid": "Q4700847",
    "label": "Aki Kurose Middle School Academy",
    "classes": [
     "Q149566"
    ],
    "classifier_labels": [
     "school",
     "building"
    ]
   },
   "geo": {
    "lat": 47.546131,
    "lon": -122.282561,
    "radius_m": 250
   },
   "priority": {
    "sitelinks": 1
   },
   "constraints": {
    "license_required": "CC-BY-SA-4.0",
    "sensitivity": [
     "strip_gps_homes",
     "flag_faces"
    ]
   },
   "fulfillment": {
    "endpoint": "commons_upload",
    "structured_data": {
     "depicts": "Q4700847"
    }
   },
   "status_check": {
    "sparql_ask": "ASK { wd:Q4700847 wdt:P18 [] }"
   }
  },
  {
   "id": "wd-p18/Q49473166",
   "publisher": "wikimedia/wikidata-p18-missing",
   "type": "photo",
   "subject": {
    "wikidata_qid": "Q49473166",
    "label": "Atlantic City Park",
    "classes": [
     "Q22698"
    ],
    "classifier_labels": [
     "park",
     "green space"
    ]
   },
   "geo": {
    "lat": 47.527222222,
    "lon": -122.262222222,
    "radius_m": 400
   },
   "priority": {
    "sitelinks": 1
   },
   "constraints": {
    "license_required": "CC-BY-SA-4.0",
    "sensitivity": [
     "strip_gps_homes",
     "flag_faces"
    ]
   },
   "fulfillment": {
    "endpoint": "commons_upload",
    "structured_data": {
     "depicts": "Q49473166"
    }
   },
   "status_check": {
    "sparql_ask": "ASK { wd:Q49473166 wdt:P18 [] }"
   }
  }
 ]
}
